{
  "address": "addr1qxqs59lphg8g6qndelq8xwqn60ag3aeyfcp33c2kdp46a09re5df3pzwwmyq946axfcejy5n4x0y99wqpgtp2gd0k09qsgy6pz",
  "received_sum": [
    {
      "unit": "string",
      "quantity": "string"
    }
  ],
  "sent_sum": [
    {
      "unit": "string",
      "quantity": "string"
    }
  ],
  "tx_count": 12
}